{
  "parcel_id": "parcel_001",
  "updated_at": "2026-04-03T18:20:00Z",
  "local_controller": {
    "available": true,
    "controller_type": "home_assistant"
  },
  "control_surfaces": [
    {
      "control_id": "thermostat_main",
      "system_type": "thermostat",
      "interface_class": "home_assistant",
      "locality": "local_only",
      "integration_tier": "soft_integration",
      "enabled": false,
      "override_rule": "homeowner_opt_in_required"
    },
    {
      "control_id": "purifier_living_room",
      "system_type": "purifier",
      "interface_class": "smart_plug",
      "locality": "hybrid",
      "integration_tier": "soft_integration",
      "enabled": false,
      "override_rule": "homeowner_opt_in_required"
    }
  ]
}
